item name,price,Title,Description
agil-armour.jpg, $80.00 ,Agil's Armour,Wear Agil's Armour from the anime
agil-doll.jpg, $25.00 ,Agil Doll,A doll perfect for your collection
asuna-doll.jpg, $25.00 ,Asuna Doll,A doll perfect for your collection
asuna-dress-uniform.jpg, $90.00 ,Asuna Knights of the Blood Oath uniform,Dress like the lighning flash Asuna
asuna-hoodie-jumper.jpg, $20.00 ,Asuna  face hoodie,Have Asuna's face all over your body
asuna-jumper-hoodie.jpg, $20.00 ,Asuna hoodie,
asuna-kirito-shirt.jpg, $15.00 ,Kirito and Asuna Shirt,A shirt for the hero's. 
asuna-shirt.jpg, $15.00 ,Asuna Shirt,
asuna-uniform-dress.jpg, $100.00 ,Asuna Knights of the Blood Oath uniform,Dress like the lighning flash Asuna
crystle-necklace.jpg, $15.00 ,Crystle necklace,"Heal, teleport, unpoison your self with these crystles conviently around your neck"
kirito-asuna-acesories-bed.jpg, $30.00 ,Asuna and Kirito bed sheets,Sleep with Asuna and Kirito form SAO
kirito-asuna-jumper.jpg, $20.00 ,Characture jumpers,Wear your favourite characture on your chest
kirito-asuna-shirt.jpg, $15.00 ,Characture shirts,wear your favourite characture on your chest
kirito-asuna-shoe.jpg, $60.00 ,Characture shoes,Run like your favourite characture
kirito-doll.jpg, $25.00 ,Kirito Doll,A doll perfect for your collection
kirito-pants.jpg, $20.00 ,Kirito Pants,Have the power of kirito in your legs
kirito-sword.jpg, $110.00 ,Kirito Sword,The legendary sword the elucidator is now yours to own
kirito-sword-shirt.jpg, $10.00 ,Sword Art online shirt,Look cool with the Sword Art Online Logo
klein-acessory.jpg, $5.00 ,Klein  phone acessory,Carry Klein with you where ever you go
menu-jumper-hoodie.jpg, $25.00 ,Sword Art onlnine custom hoodie,Order a hoodie with a custome design on it
sao-dead-party-jumper.jpg, $25.00 ,Sword Art onlnine custom jumper,Order a jumper with a custome design on it
sao-kirito-shorts.jpg, $15.00 ,Asuna Shirt,Look good with Asuna on your chest
sao-underware-hollow-fragment.jpg, $10.00 ,Elucidator,look sexy with the Sword art online logo.
sao-kirito-asuno-underware.jpg, $10.00 ,Elucidator,look sexy with your favourate charactures
asuna-shirt.jpg, $20.00 ,Asuna Shirt,Look good with Asuna on your chest
silca-asuna-kirito-jumper.jpg, $25.00 ,Characture jumpers,have your favourate charature on your chest for the winter
kirito-asuna-benie-winter.jpg, $7.00 ,Characture scarf and beenie,Rug up for winter with your favourate characture
